{"claim_sha256":"80eca4dc3605529c766fc3166aae093fc907e94d24487e37efa368ac817b75d6","cleanup":"task_created_resource_absent","completed_at":"2026-08-11T02:53:35.018645+00:00","denial_class":"authorization","package_sha256":"9cb45638cfb651a4ac3ba17958880cc00bbd15d9167e182e0ca6afb8ae7a87f1","privacy":"private","provider_ref":"zigomaro/mdh-private-canary-c973345d","provider_version":1,"run_id":"c973345d-2db3-4f5b-b305-0434ed828346","scenario":"private_dataset_create_exact_readback_unauthenticated_denial_delete","schema_version":"my-data-hub-real-kaggle-canary.v1","started_at":"2026-08-11T02:53:18.843957+00:00","task_id":"bd44be03-f5bf-44ab-a9d6-c02c79c07e3f","unauthenticated_http_status":403}