{
  "schema_version": "my-data-hub-real-kaggle-canary.v1",
  "scenario": "private_dataset_create_exact_readback_unauthenticated_denial_delete",
  "task_id": "11111111-1111-4111-8111-111111111111",
  "run_id": "22222222-2222-4222-8222-222222222222",
  "provider_ref": "owner/task-created-private-canary",
  "provider_version": 1,
  "package_sha256": "aaaaaaaaaaaaaaaaaaaaaaaaaaaaaaaaaaaaaaaaaaaaaaaaaaaaaaaaaaaaaaaa",
  "claim_sha256": "bbbbbbbbbbbbbbbbbbbbbbbbbbbbbbbbbbbbbbbbbbbbbbbbbbbbbbbbbbbbbbbb",
  "privacy": "private",
  "unauthenticated_http_status": 403,
  "denial_class": "authorization",
  "cleanup": "task_created_resource_absent",
  "started_at": "2026-08-11T02:53:18Z",
  "completed_at": "2026-08-11T02:53:35Z"
}
